,Zusammenfassung,Min_Kompressionsrate,Max_Kompressionsrate,Endgueltige_Kompressionsrate,länge Zusammenfassung,länge Ausgangstext,text,text_rank_text,tokens_gesamt,token_text_rank,desired_compression_rate,text_rank_compression_rate,current_compression_rate,compression_difference,reduction_multiplier,ent_com_rate
27, ticket examiner was allegedly stabbed on Sunday by one of the three passengers. He asked them to deboard a train for traveling without tickets in Delhi.,29,79,96.42857142857143,27,28,A ticket examiner was allegedly stabbed on Sunday by one of the three passengers when he asked them to deboard a train for traveling without tickets in Delhi. The victim said that the accused had boarded a reserved coach and stabbed his arm with a sharp-edged weapon when he tried to be stern in asking them to deboard.,A ticket examiner was allegedly stabbed on Sunday by one of the three passengers when he asked them to deboard a train for traveling without tickets in Delhi.,58,28,0.23,0.4827586206896552,0.4827586206896552,-0.25275862068965516,0.4764285714285714,0.46551724137931033
28,Nearly 500 protestors pelted stones at the police outside Ghaziabad's Ala Hazrat Haj House and demanded that the facility be opened to pilgrims immediately.,25,75,100.0,24,24,"Nearly 500 protestors pelted stones at the police outside Ghaziabad's Ala Hazrat Haj House and demanded that the facility be opened to pilgrims immediately. The Haj House, which is located along the Hindon river, has remained sealed since its inauguration last year after a petition was filed against it at the National Green Tribunal.",Nearly 500 protestors pelted stones at the police outside Ghaziabad's Ala Hazrat Haj House and demanded that the facility be opened to pilgrims immediately.,54,24,0.2,0.4444444444444444,0.4444444444444444,-0.2444444444444444,0.45000000000000007,0.4444444444444444
29,Canada is investigating reports that Saudi Arabia has been using Canadian-made armoured vehicles against its citizens.,22,72,76.19047619047619,16,21,"Canada is investigating reports that Saudi Arabia has been using Canadian-made armoured vehicles against its citizens in the violence-hit Eastern Province. Videos and photos posted on social media show Saudi Arabia using Canadian equipment on Shia dissidents. Canada warned it would take action if ""it is found that Canadian exports have been used to commit serious violations of human rights"".",Canada is investigating reports that Saudi Arabia has been using Canadian-made armoured vehicles against its citizens in the violence-hit Eastern Province.,60,21,0.28,0.35,0.35,-0.06999999999999995,0.8000000000000002,0.26666666666666666
30,"Actress Taapsee Pannu turned 30 on Tuesday. She said she doesn't like typical off-the-shelf gifts and instead likes something customised on her birthday. She added, ""Every year, I like that pressure that my friends and family have to bring their creative side out and think of a gift""",51,101,97.95918367346938,48,49,"Actress Taapsee Pannu, who turned 30 on Tuesday, has said she doesn't like typical off-the-shelf gifts and instead likes something customised on her birthday. She added, ""Every year, I like that pressure that my friends and family have to bring their creative side out and think of a gift."" Taapsee is known for films like 'Pink', 'Naam Shabana', among others. ","Actress Taapsee Pannu, who turned 30 on Tuesday, has said she doesn't like typical off-the-shelf gifts and instead likes something customised on her birthday. She added, ""Every year, I like that pressure that my friends and family have to bring their creative side out and think of a gift.""",61,49,0.76,0.8166666666666667,0.8032786885245902,-0.04327868852459016,0.9461224489795919,0.7868852459016393
31,Several broadband connections of state-run MTNL were affected after a malware attack on Friday in Delhi. The attack impacted services in many households with malfunctioning of the broadband services.,30,80,100.0,29,29,Several broadband connections of state-run MTNL were affected after a malware attack on Friday in Delhi. The attack impacted services in many households with malfunctioning of the broadband services. Users were reportedly redirected to malicious web pages with ads and pornography. State-owned telecom company BSNL was also recently hit by a malware attack that changed passwords of the modems.,Several broadband connections of state-run MTNL were affected after a malware attack on Friday in Delhi. The attack impacted services in many households with malfunctioning of the broadband services.,59,29,0.38,0.4915254237288136,0.4915254237288136,-0.11152542372881358,0.7731034482758621,0.4915254237288136
32,Allahabad High Court on Monday granted bail to two accused in the 2015 lynching of Mohammad Akhlaq in Dadri for allegedly slaughtering a cow. 14 people have been granted bail.,36,86,81.08108108108108,30,37,"The Allahabad High Court on Monday granted bail to two accused in the 2015 lynching of Mohammad Akhlaq in Dadri for allegedly slaughtering a cow. A local BJP leader, who is the father of one of the accused who got bail, praised the BJP for providing justice to his son. Notably, 14 people have been granted bail in the case.  ","The Allahabad High Court on Monday granted bail to two accused in the 2015 lynching of Mohammad Akhlaq in Dadri for allegedly slaughtering a cow. Notably, 14 people have been granted bail in the case.  ",62,37,0.42,0.5833333333333334,0.5967741935483871,-0.17677419354838714,0.7037837837837837,0.4838709677419355
33,China is reportedly constructing a 12-km-long high-speed train tunnel through one of the portions of its iconic Great Wall. The line is designed for trains traveling up to 350 kmph and is expected to shorten the single-journey time from more than 3 hours to approximately one hour. Zhangjiakou city will co-host 2022 Winter Olympics.,61,111,91.52542372881356,54,59,China is reportedly constructing a 12-km-long high-speed train tunnel through one of the portions of its iconic Great Wall to connect Beijing with Zhangjiakou city which will co-host 2022 Winter Olympics. The line is designed for trains traveling up to 350 kmph and is expected to shorten the single-journey time from more than 3 hours to approximately one hour.,China is reportedly constructing a 12-km-long high-speed train tunnel through one of the portions of its iconic Great Wall to connect Beijing with Zhangjiakou city which will co-host 2022 Winter Olympics. The line is designed for trains traveling up to 350 kmph and is expected to shorten the single-journey time from more than 3 hours to approximately one hour.,59,59,0.74,1.0,1.0,-0.26,0.74,0.9152542372881356
34,"Donald Trump Jr delivered a misleading statement on his meeting with a Russian lawyer, according to a Washington Post report. US President Donald Trump personally dictated the statement, the report said.",36,86,88.57142857142857,31,35,"US President Donald Trump personally dictated a misleading statement which his son Donald Trump Jr delivered on his meeting with a Russian lawyer during the 2016 presidential election campaign, according to a Washington Post report. In his statement, Trump Jr said he discussed the adoption of Russian children with the lawyer who had offered damaging information on Hillary Clinton.","US President Donald Trump personally dictated a misleading statement which his son Donald Trump Jr delivered on his meeting with a Russian lawyer during the 2016 presidential election campaign, according to a Washington Post report.",59,35,0.39,0.5932203389830508,0.5932203389830508,-0.2032203389830508,0.6574285714285715,0.5254237288135594
35,"More than half of university students in Australia were sexually harassed at least once in 2016. Women experienced harassment and assaults at higher rates than men. Over 30,000 responses registered across the country.",47,97,73.33333333333333,33,45,"More than half of university students in Australia were sexually harassed at least once in 2016, according to a Human Rights Commission survey. With over 30,000 responses registered across the country, it was found that women experienced harassment and assaults at higher rates than men. The survey was conducted amid claims that universities were responding poorly to sexual assault incidents.","More than half of university students in Australia were sexually harassed at least once in 2016, according to a Human Rights Commission survey. With over 30,000 responses registered across the country, it was found that women experienced harassment and assaults at higher rates than men.",60,45,0.53,0.75,0.75,-0.21999999999999997,0.7066666666666667,0.55
36,"Air India's current business is ""not sustainable"" as it is neither able to generate enough cash flow, nor start repaying even the principal amount of its debt, government says.",34,84,87.87878787878788,29,33,"Air India's current business is ""not sustainable"" as it is neither able to generate enough cash flow, nor start repaying even the principal amount of its debt, the government told a Parliamentary panel. Notably, Tata Group, IndiGo, and private equity funds KKR and Warburg Pincus have expressed interest in acquiring Air India's businesses following the cabinet's approval for its disinvestment.","Air India's current business is ""not sustainable"" as it is neither able to generate enough cash flow, nor start repaying even the principal amount of its debt, the government told a Parliamentary panel.",60,33,0.46,0.55,0.55,-0.09000000000000002,0.8363636363636363,0.48333333333333334
37,"""We like roti, dal, and kadhi, so there is a change,"" Gujarat Congress MLA Gyasuddin Shaikh said.",17,67,100.0,17,17,"A Gujarati chef has been arranged for over 40 Gujarat MLAs who were flown to Bengaluru on Friday night to reportedly prevent them from switching sides to the BJP. ""We Gujaratis have food that is not very spicy. We like roti, dal, and kadhi, so there is a change,"" Gujarat Congress MLA Gyasuddin Shaikh said.","We like roti, dal, and kadhi, so there is a change,"" Gujarat Congress MLA Gyasuddin Shaikh said.",55,17,0.24,0.3090909090909091,0.3090909090909091,-0.06909090909090909,0.7764705882352941,0.3090909090909091
38,"Arvind Panagariya, the Vice Chairman of policy think-tank Niti Aayog, announced his resignation from office on Tuesday. The economist said that he would like to resume his teaching career at Columbia University in the US.",53,103,68.62745098039215,35,51,"Arvind Panagariya, the Vice Chairman of policy think-tank Niti Aayog, which replaced the 65-year-old Planning Commission, announced his resignation from office on Tuesday. The economist said that he would like to resume his teaching career at Columbia University in the US. Further, August 31 will be his last day in office.","Arvind Panagariya, the Vice Chairman of policy think-tank Niti Aayog, which replaced the 65-year-old Planning Commission, announced his resignation from office on Tuesday. The economist said that he would like to resume his teaching career at Columbia University in the US. Further, August 31 will be his last day in office.",51,51,0.55,1.0,1.0,-0.44999999999999996,0.55,0.6862745098039216
39,Censor Board chief Pahlaj Nihalani has ordered 48 cuts in the Nawazuddin Siddiqui starrer n upcoming action thriller film 'Babumoshai Bandookbaaz' The film is scheduled to release on August 25. Directed by Kushan Nandy and also starring Bengali actress Bidita Bag.,63,113,68.33333333333333,41,60,"Censor Board chief Pahlaj Nihalani has ordered 48 cuts in the Nawazuddin Siddiqui starrer n upcoming action thriller film 'Babumoshai Bandookbaaz'. ""We are just doing our job,"" Nihalani said when asked about the number of cuts that have been ordered. Directed by Kushan Nandy and also starring Bengali actress Bidita Bag, the film is scheduled to release on August 25.","Censor Board chief Pahlaj Nihalani has ordered 48 cuts in the Nawazuddin Siddiqui starrer n upcoming action thriller film 'Babumoshai Bandookbaaz'. ""We are just doing our job,"" Nihalani said when asked about the number of cuts that have been ordered. Directed by Kushan Nandy and also starring Bengali actress Bidita Bag, the film is scheduled to release on August 25.",60,60,0.71,1.0,1.0,-0.29000000000000004,0.71,0.6833333333333333
40,Hafiz Saeed's house arrest extended for another two months. Pakistan wants to maintain public order. Saeed is a UN-designated terrorist.,25,75,83.33333333333334,20,24,"Pakistan has extended the house arrest of UN-designated terrorist and Mumbai terror attack mastermind Hafiz Saeed for another two months to maintain public order. Liberty of Saeed is a continuous threat to the peace and tranquillity in the country, Pakistani authorities said. The Jamaat-ud-Dawa (JuD) chief has been under house arrest since January 31 this year.",Pakistan has extended the house arrest of UN-designated terrorist and Mumbai terror attack mastermind Hafiz Saeed for another two months to maintain public order.,56,24,0.29,0.42857142857142855,0.42857142857142855,-0.13857142857142857,0.6766666666666666,0.35714285714285715
41,"Qatar files a legal complaint at the World Trade Organisation (WTO) against a trade boycott by Saudi Arabia, Bahrain, and United Arab Emirates.",26,76,92.0,23,25,"Qatar on Monday filed a legal complaint at the World Trade Organisation (WTO) against a trade boycott by Saudi Arabia, Bahrain, and United Arab Emirates. By formally requesting consultations with the three countries, Qatar has triggered a 60-day deadline for them to settle the complaint or face litigation at the WTO and potential retaliatory trade sanctions.","Qatar on Monday filed a legal complaint at the World Trade Organisation (WTO) against a trade boycott by Saudi Arabia, Bahrain, and United Arab Emirates.",56,25,0.33,0.44642857142857145,0.44642857142857145,-0.11642857142857144,0.7392,0.4107142857142857
42,"Tata Motors CEO Guenter Butschek took home over ?22.55 crore last fiscal. Other key officials saw their remunerations cut amid mounting losses. However, most independent directors, except Nusli Wadia, who was removed from the board last year, saw their",44,94,92.85714285714286,39,42,"Tata Motors CEO Guenter Butschek took home over ?22.55 crore last fiscal, while other key officials saw their remunerations cut amid mounting losses. Executive Director Satish Borwankar, who has taken over as COO, saw a cut of 12% to ?2.14 crore. However, most independent directors, except Nusli Wadia, who was removed from the board last year, saw their remunerations grow.","Tata Motors CEO Guenter Butschek took home over ?22.55 crore last fiscal, while other key officials saw their remunerations cut amid mounting losses. However, most independent directors, except Nusli Wadia, who was removed from the board last year, saw their remunerations grow.",60,42,0.45,0.7,0.7,-0.24999999999999994,0.6428571428571429,0.65
43,Athawale said the national song was being brought out to cause feud among communities.,18,68,77.77777777777779,14,18,"Union Minister Ramdas Athawale has said that there was nothing wrong if one didn?t recite the national song ?Vande Mataram.? Athawale added that the issue of the national song was being brought out to cause feud among communities. The Madras High Court recently made singing ?Vande Mataram? compulsory once a week in government schools, colleges and universities in Tamil Nadu.",Athawale added that the issue of the national song was being brought out to cause feud among communities.,60,18,0.22,0.3,0.3,-0.07999999999999999,0.7333333333333334,0.23333333333333334
44,Ghaziabad police arrest man in possession of arms. He was to allegedly deliver to an unidentified buyer on the same day. He has also been to jail earlier in connection with manufacturing and supplying arms.,43,93,85.36585365853658,35,41,"Ghaziabad police on Monday arrested a man in possession of arms that he was to allegedly deliver to an unidentified buyer on the same day. Police have recovered 31 countrymade weapons and 16 live cartridges that were allegedly manufactured at an illegal arms factory. He has also been to jail earlier in connection with manufacturing and supplying arms, police said.","Ghaziabad police on Monday arrested a man in possession of arms that he was to allegedly deliver to an unidentified buyer on the same day. He has also been to jail earlier in connection with manufacturing and supplying arms, police said.",60,41,0.5,0.6833333333333333,0.6833333333333333,-0.18333333333333335,0.7317073170731707,0.5833333333333334
45,"Supreme Court agrees to hear a plea seeking cancellation of Bihar CM Nitish Kumar's state Legislative Council membership. Kumar was accused of killing a Congress leader in 1991, according to the plea. The Supreme Court will hear the plea on Tuesday.",46,96,93.18181818181817,41,44,"The Supreme Court on Tuesday agreed to hear a plea seeking cancellation of Bihar CM Nitish Kumar's state Legislative Council membership for allegedly hiding a pending criminal case against him. According to the plea, Kumar was accused of killing a Congress leader in 1991. The petitioner also sought a direction to the CBI to register an FIR against Kumar.","The Supreme Court on Tuesday agreed to hear a plea seeking cancellation of Bihar CM Nitish Kumar's state Legislative Council membership for allegedly hiding a pending criminal case against him. According to the plea, Kumar was accused of killing a Congress leader in 1991.",59,44,0.69,0.7457627118644068,0.7457627118644068,-0.055762711864406844,0.9252272727272727,0.6949152542372882
46,"The Karnataka High Court barred a debt-ridden businessman from going abroad. The man, Nitin Shambhu Kumar Kasliwal, owes ?6,494 crore to banks including Punjab National Bank.",38,88,70.27027027027027,26,37,"The Karnataka High Court barred a debt-ridden businessman from going abroad, citing Vijay Mallya's case. The man, Nitin Shambhu Kumar Kasliwal, owes ?6,494 crore to banks including Punjab National Bank, Central Bank, and UCO Bank, among others. The prosecution expressed that it fears if he is allowed to go abroad, the banks might not be able to recover their money.","The Karnataka High Court barred a debt-ridden businessman from going abroad, citing Vijay Mallya's case. The man, Nitin Shambhu Kumar Kasliwal, owes ?6,494 crore to banks including Punjab National Bank, Central Bank, and UCO Bank, among others.",60,37,0.59,0.6166666666666667,0.6166666666666667,-0.026666666666666727,0.9567567567567566,0.43333333333333335
47,42 children went missing over the last three years from a Mumbai remand home. Bombay High Court criticised the Maharashtra government for lack of 'pro-active action' in the matter.,63,113,48.333333333333336,29,60,The Bombay High Court on Monday summoned the Maharashtra Women and Child Development Secretary after 42 children went missing over the last three years from a Mumbai remand home. The court criticised the Maharashtra government for lack of 'pro-active action' in the matter. The Bombay High Court is hearing a PIL on the allegations of corruption in the remand home.,The Bombay High Court on Monday summoned the Maharashtra Women and Child Development Secretary after 42 children went missing over the last three years from a Mumbai remand home. The court criticised the Maharashtra government for lack of 'pro-active action' in the matter. The Bombay High Court is hearing a PIL on the allegations of corruption in the remand home.,60,60,0.52,1.0,1.0,-0.48,0.52,0.48333333333333334
48,"MISA detainees have demanded to be treated as freedom fighters. They say that detainees in UP, MP, Bihar and Chhattisgarh are considered at par with the freedom fighters and are given pensions. Nitin Gadkari has demanded that Maharashtra government provide special facilities to the persons detained during the Emergency.",61,111,83.05084745762711,49,59,"Union Transport Minister Nitin Gadkari has demanded that Maharashtra government provide special facilities to the persons detained during the Emergency under the Maintenance of Internal Security Act (MISA). MISA detainees have demanded to be treated as freedom fighters saying that detainees in UP, MP, Bihar and Chhattisgarh are considered at par with the freedom fighters and are given pensions.","Union Transport Minister Nitin Gadkari has demanded that Maharashtra government provide special facilities to the persons detained during the Emergency under the Maintenance of Internal Security Act (MISA). MISA detainees have demanded to be treated as freedom fighters saying that detainees in UP, MP, Bihar and Chhattisgarh are considered at par with the freedom fighters and are given pensions.",59,59,0.71,1.0,1.0,-0.29000000000000004,0.71,0.8305084745762712
49,"Police say terrorists may use sub-conventional aerial platforms. ""Certain criminal/anti-social elements ... may pose a threat to safety""",19,69,94.73684210526315,18,19,"Delhi police on Monday said that it has banned the flying of aerial vehicles till Independence Day owing to terror threat. The banned aerial vehicles include drones, paragliders, quadcopters, hang-gliders, hot-air balloons, and UAVs among others. ""Certain criminal/anti-social elements or terrorists... may pose a threat to safety...by the use of sub-conventional aerial platforms"", police said.","""Certain criminal/anti-social elements or terrorists... may pose a threat to safety...by the use of sub-conventional aerial platforms"", police said.",55,19,0.29,0.34545454545454546,0.34545454545454546,-0.05545454545454548,0.8394736842105263,0.32727272727272727
